{
  "$schema": "https://json-schema.org/draft/2020-12/schema",
  "$id": "sonata-social/ficha-post.schema.json",
  "title": "Ficha de post — Sonata Social",
  "description": "Descreve UM post (ou uma lâmina de carrossel). A IA preenche a ficha; o motor Sonata.render() faz o layout com as regras do design system. Texto com *asteriscos* marca a ênfase (Poppins 800 itálico) e só vale no campo titulo.",
  "type": "object",
  "required": [
    "modelo"
  ],
  "additionalProperties": false,
  "properties": {
    "modelo": {
      "description": "Qual modelo de layout usar. Veja ia/modelos.json para quando usar cada um.",
      "enum": [
        "frase-foto",
        "frase",
        "educativo",
        "tecnologia",
        "data",
        "depoimento",
        "fono",
        "oferta",
        "carrossel-capa",
        "carrossel-passo",
        "carrossel-fim"
      ]
    },
    "formato": {
      "description": "feed 1080×1350 (padrão), quadrado 1080×1080, story 1080×1920.",
      "enum": [
        "feed",
        "quadrado",
        "story"
      ],
      "default": "feed"
    },
    "tema": {
      "description": "Fundo do post. Cada modelo aceita só alguns temas; fora da lista, o motor usa o tema padrão do modelo.",
      "enum": [
        "claro",
        "bruma",
        "agua",
        "marinho",
        "mar"
      ]
    },
    "rotulo": {
      "type": "string",
      "maxLength": 32,
      "description": "Sobretítulo curto em caixa alta: editoria ou data. Ex.: 'Saúde auditiva', '26 de julho'."
    },
    "titulo": {
      "type": "string",
      "maxLength": 160,
      "description": "A frase principal. Um trecho de 1 a 3 palavras entre *asteriscos* vira ênfase. No depoimento, é a citação."
    },
    "apoio": {
      "type": "string",
      "maxLength": 140,
      "description": "Uma ou duas frases que completam o título. Sem asteriscos."
    },
    "corpo": {
      "type": "string",
      "maxLength": 200,
      "description": "Texto corrido, só no carrossel-passo."
    },
    "manuscrito": {
      "type": "string",
      "maxLength": 32,
      "description": "1 a 4 palavras em letra manuscrita, só no modelo data. Ex.: 'Feliz Dia dos Avós'."
    },
    "legenda": {
      "type": "string",
      "maxLength": 90,
      "description": "Assinatura da fono, nota legal ou 'Imagem ilustrativa ampliada.'"
    },
    "cta": {
      "type": "string",
      "maxLength": 28,
      "description": "Texto da pílula de chamada. Verbo + objeto. Ex.: 'Agende sua avaliação'."
    },
    "foto": {
      "$ref": "#/$defs/foto"
    },
    "pessoa": {
      "type": "object",
      "description": "Quem fala: paciente (depoimento) ou fono (fono, carrossel-fim).",
      "additionalProperties": false,
      "properties": {
        "nome": {
          "type": "string"
        },
        "detalhe": {
          "type": "string",
          "description": "Idade, cidade ou cargo. Ex.: '71 anos · Porto Alegre', 'Fonoaudióloga · sócia da Sonata'."
        },
        "foto": {
          "$ref": "#/$defs/foto"
        }
      },
      "required": [
        "nome"
      ]
    },
    "chips": {
      "type": "array",
      "maxItems": 3,
      "items": {
        "type": "string",
        "maxLength": 16
      },
      "description": "Até 3 benefícios curtos (tecnologia)."
    },
    "preco": {
      "type": "object",
      "additionalProperties": false,
      "properties": {
        "prefixo": {
          "type": "string",
          "description": "Ex.: 'a partir de'."
        },
        "valor": {
          "type": "string",
          "description": "Ex.: 'R$ 125'."
        },
        "sufixo": {
          "type": "string",
          "description": "Ex.: 'por mês'."
        }
      },
      "required": [
        "valor"
      ]
    },
    "selo": {
      "type": "object",
      "additionalProperties": false,
      "properties": {
        "topo": {
          "type": "string"
        },
        "destaque": {
          "type": "string",
          "maxLength": 4,
          "description": "Ex.: '18x'."
        },
        "base": {
          "type": "string"
        }
      },
      "required": [
        "destaque"
      ]
    },
    "passo": {
      "type": "string",
      "pattern": "^[0-9]{2}$",
      "description": "Número do passo com dois dígitos ('01'). Só quando a ordem importa."
    },
    "pagina": {
      "type": "object",
      "additionalProperties": false,
      "properties": {
        "atual": {
          "type": "integer",
          "minimum": 1
        },
        "total": {
          "type": "integer",
          "minimum": 2,
          "maximum": 10
        }
      },
      "required": [
        "atual",
        "total"
      ]
    },
    "elementos": {
      "type": "array",
      "maxItems": 2,
      "uniqueItems": true,
      "items": {
        "enum": [
          "arcos",
          "onda",
          "linha"
        ]
      },
      "description": "Troca os grafismos padrão do modelo. No máximo dois."
    },
    "logo": {
      "description": "auto escolhe pela cor do fundo. false tira o logo (miolo de carrossel).",
      "anyOf": [
        {
          "enum": [
            "auto",
            "marinho",
            "agua",
            "branco"
          ]
        },
        {
          "const": false
        }
      ]
    },
    "veu": {
      "description": "De onde sai o véu (degradê) sobre a foto. Cada modelo tem um padrão.",
      "enum": [
        "base",
        "esquerda",
        "topo"
      ]
    }
  },
  "$defs": {
    "foto": {
      "type": "object",
      "additionalProperties": false,
      "properties": {
        "src": {
          "type": "string",
          "description": "URL da imagem ou chave cadastrada em Sonata.config({fotos}). Sem src, o motor desenha um espaço reservado com o assunto."
        },
        "assunto": {
          "type": "string",
          "description": "Briefing da foto (também vira texto alternativo). Ex.: 'Avó e neto conversando de perto, luz natural'."
        },
        "foco": {
          "type": "string",
          "description": "Ponto de interesse em CSS object-position. Ex.: '50% 20%' mantém o rosto no alto, fora do véu da base."
        },
        "ondas": {
          "type": "string",
          "description": "Ponto da cabeça de quem escuta, em % do post (ex.: '46% 27%'). Desenha ondas finas ao redor."
        },
        "recorte": {
          "type": "boolean",
          "description": "true para PNG transparente de produto, que flutua sem caixa (tecnologia)."
        }
      }
    }
  }
}
