{
  "modelo": "tecnologia",
  "tema": "marinho",
  "rotulo": "Tecnologia",
  "titulo": "Pequeno no ouvido. *Enorme* na conversa.",
  "chips": [
    "Recarregável",
    "Bluetooth",
    "Discreto"
  ],
  "legenda": "Imagem ilustrativa ampliada.",
  "foto": {
    "src": "aparelho-recorte",
    "assunto": "Recorte do aparelho retroauricular",
    "recorte": true
  }
}
