{
  "modelo": "carrossel-capa",
  "tema": "mar",
  "rotulo": "Guia rápido",
  "titulo": "Como voltar a *escutar* com a Sonata",
  "apoio": "Do primeiro teste ao acompanhamento, passo a passo.",
  "foto": {
    "src": "ajuste-aparelho",
    "assunto": "Fono ajustando o aparelho de uma senhora",
    "foco": "70% 35%"
  },
  "pagina": {
    "atual": 1,
    "total": 6
  }
}
